{
  "schema_version": "0.1",
  "company_id": "DEMO_CONTRACT",
  "profile_version": "synthetic-v1",
  "user_role": "ceo",
  "as_of": "2026-10-20T08:00:00Z",
  "scoring_version": "fixture-v1",
  "rules_sha256": "0000000000000000000000000000000000000000000000000000000000000000",
  "event_id": "demo:contract",
  "event_version": 1,
  "eligibility": "deferred",
  "reason_codes": [
    "no_applicable_rule"
  ],
  "score": null,
  "raw_total": null,
  "scoring_diagnostics": null,
  "level": "unknown",
  "reasons": [],
  "candidate_channels": [],
  "feature_ids": [],
  "claim_ids": [],
  "evidence_status": "insufficient",
  "limitations": [
    "Synthetic fixture"
  ]
}
